{
  "$schema": "https://json-schema.org/draft/2020-12/schema",
  "$id": "https://what-the-hell-real-estate.local/schemas/model-lock.schema.json",
  "title": "PDF OCR model artifact lock",
  "type": "object",
  "additionalProperties": false,
  "required": [
    "schema_version",
    "generated_at",
    "cache_environment_variable",
    "packages",
    "artifacts"
  ],
  "properties": {
    "schema_version": {
      "const": "2.0.0"
    },
    "generated_at": {
      "type": "string",
      "format": "date-time",
      "minLength": 1
    },
    "cache_environment_variable": {
      "const": "PDF_OCR_MODEL_HOME"
    },
    "packages": {
      "type": "array",
      "minItems": 4,
      "maxItems": 4,
      "uniqueItems": true,
      "items": {
        "type": "object",
        "additionalProperties": false,
        "required": ["name", "version"],
        "properties": {
          "name": {
            "enum": [
              "rapidocr",
              "onnxruntime",
              "docling",
              "docling-ibm-models"
            ]
          },
          "version": {
            "type": "string",
            "minLength": 1
          }
        }
      }
    },
    "artifacts": {
      "type": "array",
      "minItems": 1,
      "items": {
        "$ref": "#/$defs/artifact"
      }
    }
  },
  "$defs": {
    "relativePath": {
      "type": "string",
      "minLength": 1,
      "pattern": "^(?!/)(?![A-Za-z]:)(?!.*\\\\)(?!.*//)(?!.*(?:^|/)\\.\\.(?:/|$))(?!.*(?:^|/)\\.(?:/|$)).+$"
    },
    "entrypointPath": {
      "anyOf": [
        {
          "const": "."
        },
        {
          "$ref": "#/$defs/relativePath"
        }
      ]
    },
    "file": {
      "type": "object",
      "additionalProperties": false,
      "required": ["path", "bytes", "sha256"],
      "properties": {
        "path": {
          "$ref": "#/$defs/relativePath"
        },
        "bytes": {
          "type": "integer",
          "minimum": 1
        },
        "sha256": {
          "type": "string",
          "pattern": "^sha256:[0-9a-f]{64}$"
        }
      }
    },
    "artifact": {
      "type": "object",
      "additionalProperties": false,
      "required": [
        "component",
        "role",
        "name",
        "source_url",
        "license",
        "root",
        "entrypoint",
        "files"
      ],
      "properties": {
        "component": {
          "enum": ["RAPIDOCR", "DOCLING", "TABLEFORMER"]
        },
        "role": {
          "enum": [
            "rapidocr_det",
            "rapidocr_cls",
            "rapidocr_rec",
            "rapidocr_rec_keys",
            "rapidocr_font",
            "docling_layout",
            "tableformer"
          ]
        },
        "name": {
          "type": "string",
          "pattern": ".*\\S.*"
        },
        "source_url": {
          "type": "string",
          "format": "uri",
          "pattern": "^https://"
        },
        "license": {
          "type": "string",
          "pattern": ".*\\S.*"
        },
        "root": {
          "$ref": "#/$defs/relativePath"
        },
        "entrypoint": {
          "$ref": "#/$defs/entrypointPath"
        },
        "files": {
          "type": "array",
          "minItems": 1,
          "uniqueItems": true,
          "items": {
            "$ref": "#/$defs/file"
          }
        }
      }
    }
  }
}
